"conversation_id_str","created_at","favorite_count","full_text","id_str","image_url","in_reply_to_screen_name","lang","location","quote_count","reply_count","retweet_count","tweet_url","user_id_str","username"
"1532886726439747585","Sat Jun 04 00:47:29 +0000 2022","17","Pemerintah ttp berkomitmen dlm membangun Ibu Kota Nusantara melalui Kementerian dan lembaga terus melakukan sinergi dgn Pemda dlm mengelola permasalahan tanah dan kehutanan dikawasan IKN. Pembangunan IKN merupakan ihktiar dari Pemerintah utk meningkatkan kesejahteraan masyarakat https://t.co/ioC5yvR1OQ","1532886726439747585","https://pbs.twimg.com/media/FUXoV9waQAECmnb.jpg","","in","","2","6","13","https://twitter.com/SakiinaQhiCO_33/status/1532886726439747585","1374763538","SakiinaQhiCO_33"
"1532513393365528576","Fri Jun 03 00:04:00 +0000 2022","15","Pembangunan IKN akan memperhatikan Environmental Social and Governance (ESG) Hal itu sebagai upaya untuk membuka para investor datang ke ibu kota baru tersebut. Bahkan Tony Blair juga akan membantu pembangunan dan juga ikut mempromosikan IKN kepada para investor. https://t.co/oHzEPnqAvd","1532513393365528576","https://pbs.twimg.com/media/FUQcg-4akAALWED.jpg","","in","Bandung, Jawa Barat","1","7","15","https://twitter.com/my_ways08/status/1532513393365528576","128641833","my_ways08"
"1532275986657529862","Thu Jun 02 08:20:38 +0000 2022","14","Kepala Otorita Ibu Kota Nusantara (OIKN) Bambang Susantono bertemu dengan mantan Perdana Menteri Inggris Tony Blair di Jakarta pada Rabu 1 Juni 2022. Dalam pertemuan tersebut membahas terkait foreign direct investment ke IKN. #KotaDuniauntukSemua #Nusantara #IbuKotaNegara https://t.co/FLaS0GAJla","1532275986657529862","https://pbs.twimg.com/media/FUO82W1UsAAh8w1.jpg","","in","","1","2","5","https://twitter.com/ikn_id/status/1532275986657529862","1455419498018656256","ikn_id"
"1534320853525184512","Tue Jun 07 23:46:12 +0000 2022","2","Kepala otorita IKN ibukota Nusantara bakal terapkan energi hijau #UntukKebaikanNKRI https://t.co/J1t5Q41KKK","1534320853525184512","https://pbs.twimg.com/media/FUsArtFaMAAKfI0.jpg","","in","","0","0","0","https://twitter.com/KatokRombeng/status/1534320853525184512","1421352765847064577","KatokRombeng"
"1534466545535320064","Wed Jun 08 09:25:08 +0000 2022","71","Kementerian PUPR tengah menggelar proses Penjurian Tahap I Sayembara Konsep Perancangan Kawasan dan Bangunan Gedung di Ibu Kota Negara (IKN) Nusantara untuk Kompleks Istana Wapres Perkantoran Legislatif Perkantoran Yudikatif serta Peribadatan. #SigapMembangunNegeri https://t.co/M9ekfOqXL8","1534466545535320064","https://pbs.twimg.com/media/FUt-HXIaIAAci6K.jpg","","in","Jl. Pattimura no.20","0","3","6","https://twitter.com/KemenPU/status/1534466545535320064","179835283","KemenPU"
"1533811702612971520","Mon Jun 06 14:03:01 +0000 2022","0","IKN (Ibukota baru) dari sudut pandang militer. https://t.co/MUI96YqVmR","1533811702612971520","https://pbs.twimg.com/media/FUkxnA9aIAAIXfu.jpg","","in","","0","1","0","https://twitter.com/tani_akun/status/1533811702612971520","1496971545834827776","tani_akun"
"1533610577192689664","Mon Jun 06 00:43:49 +0000 2022","23","Presiden @jokowi memberikan beberapa arahan pembangunan wilayah Ibu Kota Nusantara (IKN) : 1. Perencanaan dan pelaksanaan dalam pembangunan lebih dimatangkan dan melibatkan semua kementerian/lembaga terkait berkoordinasi. https://t.co/kphJlzlwl8","1533610577192689664","https://pbs.twimg.com/media/FUh6KUKakAEoltT.jpg","","in","indonesia","0","1","5","https://twitter.com/pnugroho28/status/1533610577192689664","4721766133","pnugroho28"
"1533606977997537280","Mon Jun 06 00:29:31 +0000 2022","1","Ibukota negara IKN Nusantara akan menjadi kota hijau #AyoIndonesiaPastiPulih #AyoIndonesiaPastiPulih https://t.co/F2J6jKjQkQ","1533606977997537280","https://pbs.twimg.com/media/FUh3aW4aIAAF6iE.jpg","","in","Denpasar, Bali","0","0","0","https://twitter.com/BachtiarKakang/status/1533606977997537280","1530532592298369025","BachtiarKakang"
"1533605698025984000","Mon Jun 06 00:24:26 +0000 2022","1","Ibukota negara (IKN) Nusantara akan menjadi kota hijau #AyoIndonesiaPastiPulih https://t.co/vJ79LusmxS","1533605698025984000","https://pbs.twimg.com/media/FUh2P7VaAAAA4wk.jpg","","in","DKI Jakarta, Indonesia","0","0","0","https://twitter.com/MillyBachtiar/status/1533605698025984000","1530527025278361601","MillyBachtiar"
"1534726827075321856","Thu Jun 09 02:39:24 +0000 2022","0"," Enggak akan ada masyarakat IKN yang dirugikan. Jaminan itu! #ibukota #ikn #iknnusantara #presidenjokowi #indonesia https://t.co/71FoXSKJUm","1534726827075321856","https://pbs.twimg.com/media/FUxx6VwagAA90Dq.jpg","","in","","0","0","0","https://twitter.com/Dewianjani97/status/1534726827075321856","1516247224002711559","Dewianjani97"
"1534323884480405504","Tue Jun 07 23:58:15 +0000 2022","1","Kepala otorita IKN : ibukota Nusantara bakal terapkan energi hijau #UntukKebaikanNKRI https://t.co/2ipeWbzqsb","1534323884480405504","https://pbs.twimg.com/media/FUsDb4OaAAA0vhA.jpg","","in","Denpasar, Bali","0","0","0","https://twitter.com/BachtiarKakang/status/1534323884480405504","1530532592298369025","BachtiarKakang"
"1534323298712326144","Tue Jun 07 23:55:55 +0000 2022","1","Kepala otorita IKN : ibukota Nusantara bakal terapkan energi hijau #UntukKebaikanNKRI https://t.co/YaN9934QJ0","1534323298712326144","https://pbs.twimg.com/media/FUsC5yuacAAQSOO.jpg","","in","DKI Jakarta, Indonesia","0","0","0","https://twitter.com/MillyBachtiar/status/1534323298712326144","1530527025278361601","MillyBachtiar"
"1533068567901458432","Sat Jun 04 12:50:04 +0000 2022","11","Presiden Minta Perencanaan dan Pelaksanaan Pembangunan di IKN Lebih Dimatangkan Presiden Jokowi memberikan beberapa arahan dalam mempersiapkan pembangunan wilayah Ibu Kota Nusantara (IKN). https://t.co/sl1a4qXVGJ","1533068567901458432","https://pbs.twimg.com/media/FUaNu33agAA2IJy.jpg","","in","","0","1","6","https://twitter.com/hrmnt__/status/1533068567901458432","546956094","hrmnt__"
"1532876876716179456","Sat Jun 04 00:08:21 +0000 2022","15","Pembangunan Ibu Kota Negara (IKN) Nusantara merupakan upaya pemerintah untuk mengusung pembangunan ekonomi yang inklusif dengan menyebarluaskan magnet pertumbuhan ekonomi baru sehingga tidak hanya bertumpu di Pulau Jawa semata. https://t.co/zqXJ3emXld","1532876876716179456","https://pbs.twimg.com/media/FUXfY_oVsAA5cJ4.jpg","","in","Indonesia","0","6","14","https://twitter.com/Saodah1234/status/1532876876716179456","1272953532535062529","Saodah1234"
"1534310084771209217","Tue Jun 07 23:03:24 +0000 2022","0","Kepala Otoritas IKN: Ibukota Nusantara bakal terapkan energi Hijau. Semoga terealisasi dg baik. #UntukKebaikanNKRI https://t.co/KihFU96XLL","1534310084771209217","https://pbs.twimg.com/media/FUr2yw-UEAAaJ-e.jpg","","in","","0","0","0","https://twitter.com/CutClavia/status/1534310084771209217","1475753840414625794","CutClavia"
"1533584456652533761","Sun Jun 05 23:00:01 +0000 2022","0","Ibukota Negara (IKN) Nusantara akan menjadi kota hijau. Rencana pembabgunan nntinya akan terus memperhatikan keasrian kalimantan. #AyoIndonesiaPastiPulih https://t.co/09r9OqaFlS","1533584456652533761","https://pbs.twimg.com/media/FUhhqJnaAAE4dDo.jpg","","in","","0","0","0","https://twitter.com/ArdionaBarra/status/1533584456652533761","1474617342285926405","ArdionaBarra"
"1532285532423606272","Thu Jun 02 08:58:34 +0000 2022","13","Seiring dengan pengesahan UU Ibu Kota Negara (IKN) pada 18 Januari 2022 lalu proses pemindahan IKN ke Kalimantan Timur telah mulai secara bertahap. https://t.co/ymxPEKXnsn","1532285532423606272","https://pbs.twimg.com/media/FUPFE5-UYAAeOau.jpg","","in","Jakarta","1","1","5","https://twitter.com/CSISIndonesia/status/1532285532423606272","1445394860","CSISIndonesia"
"1533750556644106240","Mon Jun 06 10:00:03 +0000 2022","4","Hai SohIB! #IbuKota Indonesia akan berpindah dari Jakarta ke #Nusantara pada 2024. Namun tahukah SohIB karena berbagai alasan ternyata #IbuKota Indonesia pernah berpindah-pindah loh. #IndonesiaBaik #YangMudaSukaData #IKN #IbuKotaNegara #Sejarah #KominfoNewsroom https://t.co/2JYhjHXLZM","1533750556644106240","https://pbs.twimg.com/media/FUXmebbaMAAvm9k.jpg","","in","Indonesia","1","0","1","https://twitter.com/IndonesiaBaikId/status/1533750556644106240","831050085534363648","IndonesiaBaikId"
"1533584450512007168","Sun Jun 05 23:00:00 +0000 2022","0","Pembangunan IKN tetap menjaga kelestarian lingkungan hidup. IKN ini akan menjadi ibukota dengan kota hijau yabg banyak sekali tanaman hijau. #AyoIndonesiaPastiPulih https://t.co/s9wR5kC6d6","1533584450512007168","https://pbs.twimg.com/media/FUhh7TzVIAAA6Fe.jpg","","in","","0","0","0","https://twitter.com/CutClavia/status/1533584450512007168","1475753840414625794","CutClavia"
"1532739624317071360","Fri Jun 03 15:02:58 +0000 2022","50","Presiden @jokowi memimpin Rapat membahas Pelepasan Kawasan Hutan dan Penyediaan Lahan di Wilayah Ibu Kota Negara Istana Bogor Jumat (03/06/2022). Rapat tersebut dihadiri antara lain oleh Sekretaris Kabinet @pramonoanung dan Kepala Otorita IKN Bambang Susantono. #SidangKabinet https://t.co/On44cdY58F","1532739624317071360","https://pbs.twimg.com/media/FUVihzuUcAEYJxf.jpg","","in","Jakarta","0","5","9","https://twitter.com/setkabgoid/status/1532739624317071360","260686783","setkabgoid"
"1534166228289302530","Tue Jun 07 13:31:46 +0000 2022","0","Pemindahan Ibu Kota diharapkan mampu menciptakan pemerataan pertumbuhan. Follow @beritaupdatelpm #ikn #kalimantan #kalimantantimur #ibukota #penajam #pemerintah #jokowidodo #jokowi #presiden #presidenjokowi #dpr https://t.co/AJr7136use","1534166228289302530","https://pbs.twimg.com/media/FUp0CpSUcAEJBFj.jpg","","in","","0","0","0","https://twitter.com/KabarNusantara3/status/1534166228289302530","1532972733755437058","KabarNusantara3"
"1533965165858676736","Tue Jun 07 00:12:49 +0000 2022","1","Perencanaan pembangunan ibukota Nusantara (IKN) akan terus dilakukan hal itu sudah dipersiapkan dengan perencanaan yang semakin matang untuk mencapai target #SemangatMendukungNKRI https://t.co/zDiPqTenAI","1533965165858676736","https://pbs.twimg.com/media/FUm8qRPUcAAY0xa.jpg","","in","","0","0","0","https://twitter.com/Blackat17274188/status/1533965165858676736","1480486188595048448","Blackat17274188"
"1533601441943674881","Mon Jun 06 00:07:31 +0000 2022","0","Ibukota negara (IKN) Nusantara akan menjadi kota hijau #AyoIndonesiaPastiPulih https://t.co/E2g8ttUYEA","1533601441943674881","https://pbs.twimg.com/media/FUhyLh4UAAAT_W3.jpg","","in","","0","0","0","https://twitter.com/Cahaya08971910/status/1533601441943674881","1489197967479169027","Cahaya08971910"
"1533364278681477121","Mon Jun 06 05:11:18 +0000 2022","0","@TohidTri @kumur69 @FeniRose_ Ini adalah peta IKN(Ibukota Nusantara) dan letaknya ditengah hutan gk mungkin kn pohon gk ditebang nanti dimana mereka buat istana kantor DPR dll https://t.co/kNjlvMni27","1533677892214722560","https://pbs.twimg.com/media/FUi36h-UEAANhb3.jpg","TohidTri","in","","0","1","0","https://twitter.com/Fiziii1769/status/1533677892214722560","1477161874902769666","Fiziii1769"
"1533682503625895936","Mon Jun 06 05:29:37 +0000 2022","25","Dukung Ibu Kota Baru KNPI Gelar Rapat Formatur di IKN Nusantara @jokowi https://t.co/pfAKcXLzud","1533682503625895936","","","in","Jakarta Capital Region, Indone","5","58","5","https://twitter.com/knpiharis/status/1533682503625895936","1355843073230553088","knpiharis"
"1532768566323335168","Fri Jun 03 17:02:11 +0000 2022","1","Tapi tetep saya warga negara Indonesia yg masih memiliki sopan santun dan tetep mendoakan Pak Anis jadi Presiden setelah nanti Jan Etes jadi Gubernur Ibukota IKN. Gimana Setuju kan. Salam buat buntelan Ketut @MNW_MNW_MNW Semoga asam uratnya bisa diatasi https://t.co/JPV2akXTGh","1532769627062751232","https://pbs.twimg.com/media/FUV92BeUsAID1j7.jpg","Lintingan_Mbako","in","Jiput, Indonesia","0","1","0","https://twitter.com/Lintingan_Mbako/status/1532769627062751232","843500392755355650","Lintingan_Mbako"
"1534732019166392320","Thu Jun 09 03:00:01 +0000 2022","11","Kepala Otorita Ibu Kota Nusantara akan mengelola anggaran IKN. Baca penjelasan lengkapnya di utas berikut yuk!","1534732019166392320","","","in","Indonesia","0","1","14","https://twitter.com/KemenkeuRI/status/1534732019166392320","600673907","KemenkeuRI"
"1533210759005671424","Sat Jun 04 22:15:05 +0000 2022","0","PLN menempatkan satu Stasiun Pengisian Listrik Umum (SPLU) di kawasan Titik Nol Ibukota Nusantara (IKN). SPLU ini diharapkan dapat membantu aparat pemerintahan aparat keamanan juga masyarakat untuk mendapatkan listrik PLN ... https://t.co/AIZi1FDNHf","1533210759005671424","","","in","","0","0","0","https://twitter.com/bitovimanovski/status/1533210759005671424","24328236","bitovimanovski"
"1533733464474030080","Mon Jun 06 08:52:07 +0000 2022","28","Apakah Dunia sudah tahu bahwa Jakarta itu (sudah) bukan ibukota NKRI lagi? Jika Dunia masih anggap Jakarta itu IKN maka yg wajib terima award-nya tentu Presiden RI...","1533733464474030080","","","in","","1","1","4","https://twitter.com/AdhieMassardi/status/1533733464474030080","62854021","AdhieMassardi"
"1532924733481549824","Sat Jun 04 03:18:31 +0000 2022","10","Presiden Joko Widodo memberikan beberapa arahan dalam mempersiapkan pembangunan wilayah Ibu Kota Nusantara (IKN). Demikian disampaikan Kepala Badan Otorita IKN Bambang Susantono dalam keterangannya usai mengikuti ratas di Istana Kepresidenan Bogor pada Jumat 3 Juni 2022. https://t.co/4aKDQn2J0k","1532924733481549824","https://pbs.twimg.com/ext_tw_video_thumb/1532924373148917760/pu/img/X1R9OcojddblWwNg.jpg","","in","","0","1","8","https://twitter.com/T4kt4upun/status/1532924733481549824","1211608343648727040","T4kt4upun"
"1533650018195755008","Mon Jun 06 03:20:32 +0000 2022","0","Kami Mendukung penuh Ibukota Pembangunan IKN Nusantara Di kalimantan . Indonesia Sambut G20","1533650018195755008","","","in","Indonesia","0","0","0","https://twitter.com/detik_ntt/status/1533650018195755008","1506156652008927236","detik_ntt"
"1534364745511346177","Wed Jun 08 07:45:08 +0000 2022","0","@KotaNusantara masyarakat dukung ibukota Nusantara #IbukotaNegara #IKN #SemangatNusantara","1534441380155895808","","KotaNusantara","in","","0","0","0","https://twitter.com/melda_centil/status/1534441380155895808","285986278","melda_centil"
"1531930491124842497","Wed Jun 01 09:27:45 +0000 2022","3","Kementerian PUPR telah memulai proses lelang untuk sejumlah proyek pengerjaan infrastruktur dasar di Ibukota Negara Nusantara atau IKN. https://t.co/TusANbY7vV","1531930491124842497","","","in","Jakarta, Indonesia","3","1","0","https://twitter.com/detikfinance/status/1531930491124842497","135795460","detikfinance"
"1533703283453267968","Tue Jun 07 05:05:29 +0000 2022","0","@kumparan Ini yang dinamakan program maksa. Bukannya menyelesaikan masalah tapi memindahkan masalah. At the End Mangkrak INGAT apa hayo alasan dulunya mindahkan ibukota ke IKN?","1534038814963904512","","kumparan","in","","0","0","0","https://twitter.com/naapenaa/status/1534038814963904512","1527130514133766144","naapenaa"
"1534025580244799488","Tue Jun 07 04:12:53 +0000 2022","0","Sedang dihitung estimasi anggaran untuk pindah ikn. Gw kira pindah ibukota hanya mitos :')","1534025580244799488","","","in","","1","6","0","https://twitter.com/PriciliaAB/status/1534025580244799488","117740487","PriciliaAB"
"1531397672082735104","Mon Jun 06 13:48:51 +0000 2022","0","@alisyarief Sptnya bukan masalah gajinya yg jadi masalah tapi hrs teken kontrak utk mau pindah ke IKN ibukota yg masih belum jelas juntrungannya sama aja dgn pindah ke hutan belantara","1533808137945649157","","alisyarief","in","","0","0","0","https://twitter.com/Sutikno083/status/1533808137945649157","757033263395278848","Sutikno083"
"1532874923831881729","Sat Jun 04 12:39:32 +0000 2022","0","@panca66 Woy.. @panca66 pekok....duwit hambalang piye kabare????sok keminter ngurusi IKN....tenang IKN bakalan beres jadi ibukota....gak kayak candi hambalng....dasar panca pekok......","1533065919127117824","","panca66","in","","0","0","0","https://twitter.com/MochRid51019382/status/1533065919127117824","1462372318760423427","MochRid51019382"
