"conversation_id_str","created_at","favorite_count","full_text","id_str","image_url","in_reply_to_screen_name","lang","location","quote_count","reply_count","retweet_count","tweet_url","user_id_str","username"
"1550512609761275904","Fri Jul 22 16:06:27 +0000 2022","0","Kata nya Jakarta akan tenggelam maka dari itu di bangun ibukota baru (IKN). Eh kok malah Jateng yg tenggelam https://t.co/10d7WB2Ihu","1550512609761275904","https://pbs.twimg.com/ext_tw_video_thumb/1550512565595566080/pu/img/KyXUe3yaBu2oAJ1d.jpg","","in","Jakarta Capital Region","0","0","0","https://twitter.com/MTeroos/status/1550512609761275904","1314547478604050432","MTeroos"
"1552829465117351937","Fri Jul 29 01:32:49 +0000 2022","16","Warga Tiga Kecamatan di Kutai Kartanegara Kompak Dukung IKN Di sela kegiatan senam warga ternyata melakukan deklarasi sebagai bentuk dukungan terhadap pembangunan Ibu Kota Nusantara (IKN) yang berada di Kecamatan Sepaku Kabupaten Penajam Paser Utara (PPU). https://t.co/hAGQiKreQH","1552829465117351937","https://pbs.twimg.com/media/FYzCKxnVsAEyB5j.jpg","","in","Indonesia","0","4","15","https://twitter.com/Saodah1234/status/1552829465117351937","1272953532535062529","Saodah1234"
"1550484939157958656","Fri Jul 22 14:16:30 +0000 2022","0","Yachh persiapan perpindahan ibukota (IKN). Buruan dah pindah .. pulau Jawa biar agak lega'an dikit nih.. https://t.co/EGrOsDScjk","1550484939157958656","https://pbs.twimg.com/media/FYRtYU3aIAAQSjW.jpg","","in","𝖙𝖆𝖓𝖌𝖊𝖗𝖆𝖓𝖌","0","0","0","https://twitter.com/RiboetKenArok/status/1550484939157958656","300835877","RiboetKenArok"
"1553878174710149120","Sun Jul 31 23:00:01 +0000 2022","0","Pemerintah telah menandatangani perpanjangan MOU kerja sama teknis pemindahan ibukota dan pembangunan IKN. #EkonomiRILebihBaik https://t.co/adsqmAQ6jL","1553878174710149120","https://pbs.twimg.com/media/FZB6aEkVEAEbhZU.jpg","","in","","0","0","0","https://twitter.com/AkatsukiBagas/status/1553878174710149120","1475828251322769411","AkatsukiBagas"
"1553878170662621184","Sun Jul 31 23:00:00 +0000 2022","0","Pemerintah menandatangani perpanjangan MoU kerjasama teknis pemindahan ibukota dan pembangunan IKN Nusantara #EkonomiRILebihBaik https://t.co/uEOfIif7EE","1553878170662621184","https://pbs.twimg.com/media/FZB4YPUaIAAhcjf.jpg","","in","","0","0","0","https://twitter.com/GentaAdidaya/status/1553878170662621184","1469302745060425729","GentaAdidaya"
"1553878171283443712","Sun Jul 31 23:00:00 +0000 2022","0","Pemerintah menandatangani perpanjang mou kerja sama teknis pemindahan ibukota dan pembangunan ikn nusantara #EkonomiRILebihBaik https://t.co/wckGAYW7yF","1553878171283443712","https://pbs.twimg.com/media/FZByUTpakAA5WXb.jpg","","in","","0","0","0","https://twitter.com/Serly36919520/status/1553878171283443712","1473335637176553473","Serly36919520"
"1553293373909647360","Sat Jul 30 08:16:13 +0000 2022","14","Sebagai Upaya Mengurangi Import Bahan Baku Baja. Menurut @erickthohir investasi POSCO HOLDING itu akan terwujud dalam bentuk peningkatan kapasitas produksi baja otomotif untuk industri kendaraan listrik hingga proyek Ibu Kota Nusantara (IKN). #BangkitBersamaET https://t.co/CLQ5LpFm8y","1553293373909647360","https://pbs.twimg.com/media/FY5oFdraAAASVRo.jpg","","in","","0","1","10","https://twitter.com/riyadisugeng167/status/1553293373909647360","1310491734086877184","riyadisugeng167"
"1551371656043511810","Mon Jul 25 01:00:00 +0000 2022","17","Pemindahan Ibu Kota Negara adalah upaya pemerintah melakukan transformasi ekonomi di Kalimantan khususnya Kalimantan Timur. Dengan demikian Kalimantan Timur memiliki peranan penting dlm mengimplementasi strategi transformasi ekonomi Indonesia melalui pemindahan IKN https://t.co/aZ8ycwYjWf","1551371656043511810","https://pbs.twimg.com/media/FYdzsTyVsAA5ABq.jpg","","in","Gresik, Indonesia","1","5","14","https://twitter.com/AlshaibaShihab/status/1551371656043511810","1153460550","AlshaibaShihab"
"1552830112667938816","Fri Jul 29 01:35:23 +0000 2022","17","IKN Nusantara titik bangkit bagi Indonesia menuju negara maju &amp; sejahtera. Mari kita kawal &amp; dukung pembangunannya. Segala informasi perihal proses pemindahan &amp; tahap - tahap pembangunan Ibu Kota Negara bisa kita dapatkan di @ikn_id IKN Nusantara Kota Dunia Untuk Semua https://t.co/bIBZd280jW","1552830112667938816","https://pbs.twimg.com/media/FYzCwSFacAAHqr_.jpg","","in","","1","4","14","https://twitter.com/Penyair_Berdiri/status/1552830112667938816","1240137086331748352","Penyair_Berdiri"
"1552838145892179969","Fri Jul 29 02:07:18 +0000 2022","0","Kepala otorita ibukota Nusantara Bambang susantono mengungkapkan bahwa pihaknya saat ini tengah mempersiapkan penduduk lokal untuk menjadi bagian dari pembangunan ibukota negara (IKN). Booster Lindungi Diri https://t.co/yu5M11cNUq","1552838145892179969","https://pbs.twimg.com/media/FYzKDyRVUAAx1OG.jpg","","in","Cilegon","7","8","0","https://twitter.com/ReinaSari7/status/1552838145892179969","1381592482526339075","ReinaSari7"
"1552531056414208000","Thu Jul 28 05:47:03 +0000 2022","0","Pemerintah akan membangun infrastruktur air bersih di ibukota negara Nusantara (IKN) bekerja sama dengan Korea Selatan. https://t.co/KWMpYmvAjO","1552531056414208000","https://pbs.twimg.com/media/FYuywlIaMAEMKFp.jpg","","in","Banyumas, Indonesia","0","0","0","https://twitter.com/IntanAyuArimbi/status/1552531056414208000","69834086","IntanAyuArimbi"
"1553281980883959808","Sat Jul 30 07:30:57 +0000 2022","0","Ibukota Nusantara akan menjadi ibukota yang menakjubkan #IbukotaNegara #IKN #SemangatNusantara https://t.co/yCyt73Rotf","1553281980883959808","https://pbs.twimg.com/media/FY5dXzBaQAAq-jf.jpg","","in","","0","1","0","https://twitter.com/dLinda16/status/1553281980883959808","1021970643070476288","dLinda16"
"1551819416362369024","Tue Jul 26 06:39:14 +0000 2022","0","Kepala Bappenas mengunjungi US untuk mempelajari sejumlah kode transportasi untuk ibukota negara Nusantara. #IKN https://t.co/20dumUfXLQ","1551819416362369024","https://pbs.twimg.com/media/FYkrh94UIAAWmqE.jpg","","in","Banyumas, Indonesia","0","0","0","https://twitter.com/IntanAyuArimbi/status/1551819416362369024","69834086","IntanAyuArimbi"
"1549912854706368512","Thu Jul 21 00:23:15 +0000 2022","0","Pemerintah siap memberikan dukungan dalam pembangunan ibukota negara (IKN) #PastiNKRISemakinMaju https://t.co/7N317mRh4E","1549912854706368512","https://pbs.twimg.com/media/FYJg_J1UUAEty5-.jpg","","in","","0","0","0","https://twitter.com/Geymer42751530/status/1549912854706368512","1480483902074486785","Geymer42751530"
"1553721531624132609","Sun Jul 31 12:40:57 +0000 2022","20","Lebih lanjut mas ET menyampaikan Dimana nilai investasi itu akan terwujud dalam bentuk peningkatan kapasitas produksi baja otomotif untuk industri kendaraan listrik hingga proyek Ibu Kota Nusantara (IKN) @erickthohir #BangkitBersamaET https://t.co/pudi6JmR7X","1553722381725601792","https://pbs.twimg.com/media/FY_uRUiUEAAs3mr.jpg","abby6mei","in","Central Java, Indonesia","0","1","16","https://twitter.com/abby6mei/status/1553722381725601792","1379546070783430661","abby6mei"
"1549912869055057920","Thu Jul 21 00:23:18 +0000 2022","0","Dimulainya pembangunan ibukota negara (IKN) turut mendapat dukungan penuh dari PT PLN #PastiNKRISemakinMaju https://t.co/DmtZtwgwwX","1549912869055057920","https://pbs.twimg.com/media/FYJhBQiVsAAhIN2.jpg","","in","","0","0","0","https://twitter.com/Geymer42751530/status/1549912869055057920","1480483902074486785","Geymer42751530"
"1550647330642477056","Sat Jul 23 01:01:47 +0000 2022","14","Ketua DPR RI @puanmaharani_ri mendampingi Presiden @Jokowi meninjau pembangunan IKN Nusantara. Menurutnya Visi Pemerintahan Dalam Membangun IKN sudah jelas dan DPR RI berkomitmen untuk mendukung pembangunan Ibu Kota Negara Baru. https://t.co/vGSXl0claM","1550647330642477056","https://pbs.twimg.com/media/FYUBhgMaIAAkbfR.jpg","","in","","1","3","15","https://twitter.com/Penyair_Berdiri/status/1550647330642477056","1240137086331748352","Penyair_Berdiri"
"1552139982109782016","Wed Jul 27 03:53:03 +0000 2022","1","Masyarakat Merasakan Dampak Positif Pembangunan Infrastruktur Diaseluruh Pelosok Negeri Dan Mendukung Pemindahan Ibukota Negara (IKN) Vaksin Imun Kuat https://t.co/BBrA5ficS6","1552139982109782016","https://pbs.twimg.com/media/FYpPFl_VQAA1w_8.jpg","","in","Kalimantan Tengah, Indonesia","0","1","0","https://twitter.com/CikaMask/status/1552139982109782016","1525093685448146945","CikaMask"
"1549912865984811008","Thu Jul 21 00:23:17 +0000 2022","0","Ada banyak investor yang tertarik berinvestasi di mega proyek pembangunan di ibukota Nusantara (IKN) di Kalimantan timur #PastiNKRISemakinMaju https://t.co/sxiHTkW3wl","1549912865984811008","https://pbs.twimg.com/media/FYJgkt2UsAAYczX.jpg","","in","","0","0","0","https://twitter.com/Blackat17274188/status/1549912865984811008","1480486188595048448","Blackat17274188"
"1550271557527695360","Fri Jul 22 00:08:36 +0000 2022","0","Pembangunan ibukota negara (IKN) nusantara harus terus berjalan #NKRISemakinBerjaya https://t.co/4GJOsioWma","1550271557527695360","https://pbs.twimg.com/media/FYOrvODUYAAsyCR.jpg","","in","","0","0","0","https://twitter.com/Cahaya08971910/status/1550271557527695360","1489197967479169027","Cahaya08971910"
"1551821900430872576","Wed Jul 27 02:36:51 +0000 2022","1","@benzema_aly @bahlillahadalia Mau bikin ibukota kok pake investor ntar jd IKI( Ibukota Investor ) bukan IKN lg..","1552120804548419584","","aLy_bima","in","","0","0","0","https://twitter.com/namira0109/status/1552120804548419584","1136096508250509312","namira0109"
"1553394614458916864","Sat Jul 30 14:58:31 +0000 2022","2","Pemerintah Indonesia memperkuat kerja sama dengan Korea Selatan dengan perpanjangan Memorandum of Understanding (MoU) Kerja Sama Teknis Pemindahan Ibukota dan Pembangunan IKN Nusantara. https://t.co/f7AtHK0aRH","1553394614458916864","","","in","Jakarta - Indonesia","1","0","1","https://twitter.com/mediaindonesia/status/1553394614458916864","68930552","mediaindonesia"
"1552460251731210240","Thu Jul 28 03:18:17 +0000 2022","0","@abangbelneg Indonesia negaraku Nusantara ibukota ku #IbukotaNegara #IKN #SemangatNusantara","1552493621420912640","","abangbelneg","in","","0","0","0","https://twitter.com/JanjiDjoni/status/1552493621420912640","1487326840410853377","JanjiDjoni"
"1552691571937939457","Thu Jul 28 23:15:06 +0000 2022","0","@cutiepiegyul Kenapa gitu ga pemerataan ekonomi sama pembangunan di pelosok atau daerah yg ekonominya masih rendah. Biar orang-orang ga berjubel kerja di ibukota. Pake segala ada ikn. Terus jorjoran pembangunan disini buat apa kalau ibukotanya jg mau pindah ","1552794808414261252","","cutiepiegyul","in","","0","1","0","https://twitter.com/1gyulnoona/status/1552794808414261252","701205806843211776","1gyulnoona"
"1552452584279277569","Thu Jul 28 23:12:37 +0000 2022","0","@dastanjr @ibrahim1989_ @GumariAhmad @CNNIndonesia Jadi sebenernya mending ga dibikin sekalian ngga sih mas kalau cuma bisa sampe Bandung? Kalau memang bisa terwujud sampe sby gpp. Tp kita kan blm siap ttp dipaksain. Mending pemerataan ekonomi dulu sama pembangunan jd orangnya ga berjubel di ibukota. Dah mana ada ikn juga :(","1552794181944614914","","dastanjr","in","","0","0","0","https://twitter.com/1gyulnoona/status/1552794181944614914","701205806843211776","1gyulnoona"
"1550639645242691585","Sat Jul 23 01:26:50 +0000 2022","1","@giginpraginanto Tidak salah karena aset negara di ibukota pada mau disewain buat membiayayi IKN.","1550653632013832192","","giginpraginanto","in","Indonesia","0","3","0","https://twitter.com/MohArifWidarto/status/1550653632013832192","14508092","MohArifWidarto"
