"conversation_id_str","created_at","favorite_count","full_text","id_str","image_url","in_reply_to_screen_name","lang","location","quote_count","reply_count","retweet_count","tweet_url","user_id_str","username"
"1527549917442363392","Fri May 20 07:20:55 +0000 2022","27","Sinarmas Land bersama Mitsubishi dan JICA Jepang melakukan ujicoba kendaraan listrik tanpa pengemudi ( aotunomous vihecle) di BSD City dihadiri Menhub Budi Karya dll. Inilah pengembangan smart city kedepan dan mungkin akan cocok juga diterapkan di IKN . (20/5) https://t.co/SIBvQY1rx4","1527549917442363392","https://pbs.twimg.com/media/FTLyiOtVIAUm9v-.jpg","","in","Jakarta Capital Region","0","3","8","https://twitter.com/Salehhusin63/status/1527549917442363392","4433060894","Salehhusin63"
"1527481464039698432","Fri May 20 02:48:54 +0000 2022","15","Dukung penuh pembangunan IKN Nusantara . #IbukotaNegara #IKN #SemangatNusantara https://t.co/cxdm2BzhCq","1527481464039698432","https://pbs.twimg.com/media/FTK0SHMUcAA1vyO.jpg","","in","","0","9","3","https://twitter.com/RismaII4/status/1527481464039698432","1497098972443602944","RismaII4"
"1527556067743236096","Fri May 20 07:45:21 +0000 2022","2","Jumpa sahabat lama Kepala IKN Bambang Susantono bersama tim nya dari FT UI Prof Ali Berawi Prof Nandi dan Prof Yandi Atmo saat ujicoba autonomous vihecle di Q-Big BSD City.... ( Saleh Husin). https://t.co/bUUuoP64Yn","1527556067743236096","https://pbs.twimg.com/media/FTL4ImiVUAUKpL8.jpg","","in","Jakarta Capital Region","0","1","0","https://twitter.com/Salehhusin63/status/1527556067743236096","4433060894","Salehhusin63"
"1527475414259511296","Fri May 20 02:24:52 +0000 2022","3","IKN Nusantara dapat meningkatkan perekonomian Indonesia. Kearifan lokal budaya dan adat istiadatnya jangan sampai hilang dan harus dijaga #IbukotaNegara #IKN #SemangatNusantara https://t.co/9lzr91tsLB","1527475414259511296","https://pbs.twimg.com/media/FTKtlpzUYAApp0B.jpg","","in","Indonesia","0","0","0","https://twitter.com/WartaFaktual/status/1527475414259511296","1500558557535617026","WartaFaktual"
"1527630056394473472","Fri May 20 12:39:22 +0000 2022","2","Hadiri Silahturahmi MADN Cornelis Ajak Masyarakat Dayak Bersiap Sambut IKN Cornelis mengatakan bahwa sekarang kita harus mampu memikirkan bangsa ini supaya bisa ikut serta ambil bagian sebagai orang Indonesia. https://t.co/GmToUs9IGx","1527630056394473472","https://pbs.twimg.com/media/FTM7b2baAAAT5PH.jpg","","in","Indonesia","0","1","0","https://twitter.com/PDI_Perjuangan/status/1527630056394473472","153407983","PDI_Perjuangan"
"1527658301479333888","Fri May 20 14:31:36 +0000 2022","11","sejak diresmikannya titik nol #IKN Nusantara sebagai #IbukotaNegara sangat terasa dampak peningkatan ekonomi di kawasan tersebut. #SemangatNusantara https://t.co/r7AqXZuYhv","1527658301479333888","https://pbs.twimg.com/media/FTNU0LGagAAufDc.jpg","","in","Jakarta","0","1","3","https://twitter.com/abangbelneg/status/1527658301479333888","413888550","abangbelneg"
"1527605260881395713","Fri May 20 11:00:50 +0000 2022","27","Peraturan Pelaksanaan Undang-Undang Nomor 3 Tahun 2022 Tentang Ibu Kota Negara telah diundangkan pada tanggal 18 April 2022. Pantau terus informasi lengkap pada tautan https://t.co/fT7QunyB01 (link tertera di bio) #KotaDuniauntukSemua #IbuKotaNegara #Nusantara https://t.co/GMOGtdEzY7","1527605260881395713","https://pbs.twimg.com/media/FTMk4lGacAANwgF.jpg","","in","","0","2","7","https://twitter.com/ikn_id/status/1527605260881395713","1455419498018656256","ikn_id"
"1527475351407865856","Fri May 20 02:24:37 +0000 2022","1","Mantan Kepada Bappenas Kritik Sejumlah Tokoh Yang Menolak Pemindahan IKN Kinerja Jokowi Terbaik https://t.co/yZIKx89Aav","1527475351407865856","https://pbs.twimg.com/media/FTKuuFoUsAADhof.jpg","","in","Kota Padang, Sumatera Barat","0","1","0","https://twitter.com/tetapnkri17/status/1527475351407865856","1398499586897944577","tetapnkri17"
"1527800535050768385","Fri May 20 23:56:47 +0000 2022","0","IKN Nusantara akan gunakan transportasi umum tanpa pengemudi menerapkan rute dinamis. #AyoNKRIBangkit https://t.co/xPB6wIzApj","1527800535050768385","https://pbs.twimg.com/media/FTPWe5NacAEAwcm.jpg","","in","","0","0","0","https://twitter.com/nvroost/status/1527800535050768385","1479239414857408513","nvroost"
"1527543655837605888","Fri May 20 06:56:02 +0000 2022","0","APEL KEBANGSAAN PEMUDA LINTAS AGAMA Titik Nol IKN Nusantara https://t.co/hQMtClHttJ","1527543655837605888","https://pbs.twimg.com/media/FTLs27MaIAI6c7O.jpg","","in","Bandung, Indonesia","0","0","0","https://twitter.com/pemudakatolikjb/status/1527543655837605888","1220882150347591680","pemudakatolikjb"
"1527794743115018240","Fri May 20 23:33:46 +0000 2022","9","Dulu katanya IKN tidak akan membebani APBN Tapi fakta berbicara lain. #KebijakanPlangaPlongo https://t.co/y0ET49TNFd","1527794743115018240","https://pbs.twimg.com/media/FTPRN9sVsAArbPn.jpg","","in","","1","1","5","https://twitter.com/Sephia____/status/1527794743115018240","1378211292725452802","Sephia____"
"1527439236718526469","Fri May 20 00:01:07 +0000 2022","3","IKN dikembangkan dengan konsep kota hutan . 🇮🇩🇮🇩 . #DorongNKRILebihMaju https://t.co/UutbbmuwG7","1527439236718526469","https://pbs.twimg.com/media/FTKN3hgaAAA08kd.jpg","","in","Indonesia ","0","0","0","https://twitter.com/Reni75459559/status/1527439236718526469","1494670986410881029","Reni75459559"
"1527210212087975936","Thu May 19 08:51:03 +0000 2022","6","Beberapa waktu lalu saya menyetujui dibentuknya Pansus Jakarta pasca perpindahan Ibu Kota Negara (IKN). Pansus ini akan berperan aktif mengkaji kewenangan Jakarta setelah tak lagi menyandang status sebagai Ibu Kota. Saya berharap Jakarta ttp memiliki keistimewaan. https://t.co/5GOUaigEeN","1527210212087975936","https://pbs.twimg.com/media/FTG9lyNaMAAKW4c.jpg","","in","Jakarta Capital Region","1","1","1","https://twitter.com/PrasetyoEdi_/status/1527210212087975936","1088295819617267713","PrasetyoEdi_"
"1527497782071676928","Fri May 20 03:53:45 +0000 2022","1","Tonggak Pembangunan Nasional Indonesia ~ IKN NUSANTARA ~ #jokowi #Indonesia https://t.co/4etXzaUNeB","1527497782071676928","https://pbs.twimg.com/media/FTLC25BVsAE_wI7.jpg","","in","","0","0","0","https://twitter.com/Nien1708/status/1527497782071676928","1433294367486136322","Nien1708"
"1527608768183160832","Fri May 20 11:14:46 +0000 2022","1","(1/4) [𝗛-𝟭 𝗗𝗜𝗦𝗞𝗔𝗡𝗧𝗘𝗞] Pagi Teknik! Diskusi Kantin Teknik akan dilaksanakan 1 hari lagi. Bersama tiga pembicara yang ahli pada bidangnya forum diskusi ini dipercaya akan menambah wawasan kita mengenai isu IKN yang berkembang di negara ini ( ) https://t.co/GgWXd8o4k5","1527608768183160832","https://pbs.twimg.com/media/FTMoEq2VUAASs98.jpg","","in","Depok, Jawa Barat","0","2","0","https://twitter.com/BEMFTUI/status/1527608768183160832","145570516","BEMFTUI"
"1527618497068400640","Fri May 20 11:53:28 +0000 2022","2","Halo Kema Unpad! Pemindahan Ibu Kota Negara ke Kalimantan dikhawatirkan menimbulkan ancaman bagi masyarakat adat yang hidup dan tinggal di sana ancaman seperti konflik kepentingan hingga patok wilayah IKN yang tiba-tiba menerobos wilayah tanah adat. https://t.co/6ceRp2hBrp","1527618507222896641","https://pbs.twimg.com/media/FTMw7sFUcAATIY1.jpg","bem_unpad","in","","0","1","0","https://twitter.com/bem_unpad/status/1527618507222896641","198228819","bem_unpad"
"1527585123410989057","Fri May 20 09:40:49 +0000 2022","10","Yakin .. kecuali Takdir Allah. JR. UU. IKN akan KALAH VONISNYA MENOLAK GUGATAN.Krn faktor SEMENDA BOLEH DONG PENGGUGAT ESTIMASI ..PREDIKSI. Jk ada larangan memprediksi bantu dalilnya..Psl brp UU.nya apa ? Klo prediksi kami ilustrasinya ada di KODE ETIK HAKIM produk Para Hakim","1527585123410989057","","","in","","0","1","2","https://twitter.com/DamaiHariLubis/status/1527585123410989057","1502697277323837444","DamaiHariLubis"
"1527495876884975617","Fri May 20 03:46:11 +0000 2022","5","Baru di era Jokowi lah semua aset2 negara dibukukan pak Didu...Kalo pengen tahu siapa yg ngerampok aset negara tinggal liat aja bukunya...gak usah bikin opini negatif Mulu tentang pemindahan IKN. Justru para rampok2 aset negara itu banyak yg gerah saat ini...apakah termasuk loe? https://t.co/a5AB5ZTbBi","1527495876884975617","https://pbs.twimg.com/media/FTLBZzjakAAeinl.jpg","","in","NKRI Damai","0","1","0","https://twitter.com/WaraslahNKRI/status/1527495876884975617","2934277890","WaraslahNKRI"
"1527473710705176576","Fri May 20 02:18:06 +0000 2022","1","IKN pakai konsep foresc city 75 persen pembangunan hijau . . #DorongNKRILebihMaju https://t.co/crCAphcbiL","1527473710705176576","https://pbs.twimg.com/media/FTKtPrKVIAAwzw3.jpg","","in","Indonesia","0","0","0","https://twitter.com/stithyjanker50/status/1527473710705176576","2487901944","stithyjanker50"
"1527126899922714624","Fri May 20 04:31:45 +0000 2022","2","@democrazymedia Kerete Cepat Bandung-Jkt asalnya gak pake APBN tp sekarang pakai APBN. Pemindahan IKN awalnya gak pake APBN tp skrg pakai APBN. Terus Pak @aniesbaswedan punya rencana baik kerjasama transportasi lo jegal sebelum dimulai... Sebenarnya elo ini siapa?","1527507345391386624","","democrazymedia","in","","1","0","1","https://twitter.com/agussuhada5/status/1527507345391386624","1547364050","agussuhada5"
"1527186318186659840","Thu May 19 07:39:53 +0000 2022","2","@OposisiCerdas tak boleh bangun IKN pke dana haji. Tau khaan... syapa yg nenangin nge bike in calon jemaah haji. ngerayu para calon haji bwt ngikhlasin dana hajinya bwt dana pembangunan IKN. Otomatis haji para calon jemaah haji...cuma dihargai kadonyan banget...IKN. Djiantjuk !","1527192303940431873","","OposisiCerdas","in"," Indonesia","0","0","0","https://twitter.com/nugrohobagus830/status/1527192303940431873","1432899235305848834","nugrohobagus830"
"1526961468771803136","Fri May 20 01:19:04 +0000 2022","1","@satriohendri Semua program geber aja pak @jokowi Kalau pengamat mah enteng ngomongnya Minta nunda IKN tar ditunda enteng lagi keluarin komen mangkrak","1527458856292429824","","satriohendri","in","Jakarta","0","0","0","https://twitter.com/hesanpitosa/status/1527458856292429824","186434280","hesanpitosa"
"1527565360358105088","Fri May 20 12:08:53 +0000 2022","0","@MuhammadIsaMusa Ini yg bener. IKN adalah proyek Oligarki (antek Elite Global). Maka dari itu di paksakan meski APBN ludes.","1527622384689197057","","","in","","0","0","0","https://twitter.com/GrangerKeren/status/1527622384689197057","1517353022145196034","GrangerKeren"
"1526961468771803136","Fri May 20 00:50:42 +0000 2022","1","@satriohendri Pakdhe dah berusaha masih banyak yg kurang ya hrs diperbaiki sy kira membenahi ekonomi rakyat dah dilakukan sejak awal sampai skrg prioritas adl kesejahteraan rakyat IKN bisa paralel jk memang hrs ditunda pasti beliau akan menundanya.. masalah reshuflle pakdhe yg lbh tahu","1527451715330789376","","satriohendri","in","Kota Pasuruan, Jawa Timur","0","0","0","https://twitter.com/budisiswa01/status/1527451715330789376","4121124258","budisiswa01"
"1527186352969682944","Thu May 19 07:16:14 +0000 2022","0","Proyek IKN mmg sebaiknya disusun ulang ada semacam GBHN yg harus dilaksanakan pemimpin berikutnya agar berkesinambungan. Misal anggaran IKN berapa % pertahun utk kondisi normal dari APBN. Soal resuffle tak usahlah hanya menambah musuh baru.","1527186352969682944","","","in","Indonesia","0","0","0","https://twitter.com/wisanggeni_11/status/1527186352969682944","230059397","wisanggeni_11"
"1527475852539068416","Fri May 20 05:45:06 +0000 2022","3","@RaniKancana__ Raja Mulawarman memang raja terkaya di Nusantara.. Aku setuju Kutai Kertanegara pilihan tepat untuk IKN","1527525802572914688","","RaniKancana","in","Makassar, Indonesia","0","1","1","https://twitter.com/SekarTa58984305/status/1527525802572914688","1521317872534171649","SekarTa58984305"
"1527422962432737280","Fri May 20 02:18:02 +0000 2022","0","@EmilKris @EllyKoro Yuk sesekali main...palagi dekat IKN ","1527473693961506818","","","in","numpang..","0","0","0","https://twitter.com/ida2friani/status/1527473693961506818","1126132322552561670","ida2friani"
