"conversation_id_str","created_at","favorite_count","full_text","id_str","image_url","in_reply_to_screen_name","lang","location","quote_count","reply_count","retweet_count","tweet_url","user_id_str","username"
"1557500305444843520","Wed Aug 10 22:53:04 +0000 2022","8","Indonesia dikadali (dilecehkan) Tesla dan China. Padahal Nikel milik RI Terus apa hasil si Opung dan Pak Lurah bolak balik ke US merengek-rengek agar Tesla Invest diIndonesia.? ini aja ga beres omong besar kita bisa menarik investor ke IKN. Syukurin loh...sok gaya2 an ! . https://t.co/QGss0tHyuC","1557500305444843520","https://pbs.twimg.com/media/FZ1aRgbaIAE-lNH.jpg","","in","DKI Jakarta, Indonesia","1","0","5","https://twitter.com/maju_ahmad/status/1557500305444843520","834388208376963072","maju_ahmad"
"1557513166741196800","Wed Aug 10 23:44:10 +0000 2022","8","Menteri BUMN Erick Thohir berbicara terkait ibukota negara Nusantara (IKN). @erickthohir menyampaikan bahwa mau tidak mau Indonesia harus memiliki ibukota negara baru di tengah pertumbuhan perekonomian yang sangat baik dan juga pertumbuhan jumlah penduduk. #BangkitBersamaET https://t.co/TtE5SuOfPB","1557513166741196800","https://pbs.twimg.com/ext_tw_video_thumb/1557513030086565888/pu/img/zyc1k45fdnJJxAcP.jpg","","in","","0","1","8","https://twitter.com/Aprilia_wiji/status/1557513166741196800","326453024","Aprilia_wiji"
"1557143386951680001","Tue Aug 09 23:14:48 +0000 2022","530","Rakyat Marah jika Jokowi Teruskan Proyek IKN tapi Anggaran Pemilu Malah Kurang https://t.co/rcOF3zca8T","1557143386951680001","","","in","","2","15","120","https://twitter.com/OposisiCerdas/status/1557143386951680001","887743587579944960","OposisiCerdas"
"1557198641558802432","Wed Aug 10 02:54:22 +0000 2022","15","IKN Nusantara akan jadi pusat ekonomi baru - Erick Thohir - . . #Barikade98 #BangkitBersamaET #EnergiTerbaik https://t.co/kP2i8D0gLD","1557198641558802432","https://pbs.twimg.com/ext_tw_video_thumb/1557197250979573762/pu/img/b1Qcy5crE8cosqtF.jpg","","in","Jakarta Capital Region","1","1","9","https://twitter.com/barikade_98/status/1557198641558802432","1420614189421195271","barikade_98"
"1557285093475221504","Wed Aug 10 08:37:53 +0000 2022","26","lauk kg je ne....msk lemak pegaga + udang...lawan dgn ikn masin..nasi panas2...tiber orng umh lalu pon x nmpk kikikiki https://t.co/zjAN0cgjll","1557285093475221504","https://pbs.twimg.com/media/FZyWhu8akAE7nQG.jpg","","in","Kuala Lumpur City, Kuala Lumpu","0","3","2","https://twitter.com/CitgulitaB/status/1557285093475221504","2359720334","CitgulitaB"
"1557203835185074181","Wed Aug 10 03:15:00 +0000 2022","5","Dukung pemindahan IKN karena banyak manfaat untuk pembangunan dan perputaran ekonomi Indonesia https://t.co/a1nDpYU7cK","1557203835185074181","https://pbs.twimg.com/media/FZxMoXiVsAAJmiY.jpg","","in","","0","1","1","https://twitter.com/DwiDian15986493/status/1557203835185074181","1373306456854781954","DwiDian15986493"
"1557352764253937665","Wed Aug 10 13:06:47 +0000 2022","2","ledom laham kalakuan siga arteez. janjian jam 3 datang jam 7. biasa ikn macet. :)))) ler https://t.co/LEDfXGD7IF","1557352764253937665","https://pbs.twimg.com/media/FZzUFLaUIAEerMi.jpg","","in","warfield","0","3","0","https://twitter.com/overAkting/status/1557352764253937665","160422568","overAkting"
"1557170054323572736","Wed Aug 10 01:00:46 +0000 2022","21","Kepala Staf Kepresidenan (KSP) Moeldoko menegaskan pemindahan Ibu Kota Negara (IKN) Nusantara sudah final dan tidak perlu diperdebatkan lagi. Pemindahan IKN untuk mengakhiri persoalan ketimpangan antara Jawa dan luar Jawa yang telah berlangsung berpuluh-puluh tahun. https://t.co/zcu0uZTJhi","1557170054323572736","https://pbs.twimg.com/media/FZwt6PtVsAAV1x4.jpg","","in","Indonesia","2","5","17","https://twitter.com/Saodah1234/status/1557170054323572736","1272953532535062529","Saodah1234"
"1557170454330191872","Wed Aug 10 01:02:21 +0000 2022","20","Pemindahan IKN sudah final &amp; tak perlu diperdebatkan lagi sudah keputusan bersama pemerintah &amp; DPR terwujud dalam UU No 3 Tahun 2022 tentang IKN. Pemindahan IKN untuk mengakhiri persoalan ketimpangan antara jawa &amp; luar jawa yang telah berlangsung berpuluh-puluh tahun - Moeldoko https://t.co/VxTZELLhPG","1557170454330191872","https://pbs.twimg.com/media/FZwuRoxUIAIhV6r.jpg","","in","","2","3","15","https://twitter.com/Penyair_Berdiri/status/1557170454330191872","1240137086331748352","Penyair_Berdiri"
"1557285248299601920","Wed Aug 10 08:38:59 +0000 2022","7","Selanjutnya Presiden MADN mengatakan agar pembangunan di Kalimantan yang selama ini diwujudkan dalam bentuk fisik yakni pembangunan Ibu Kota Nusantara (IKN) juga melakukan pembangunan di bidang hukum dikarenakan hukum masyarakat adat di seluruh Kalimantan masih berjalan. https://t.co/XE8AA1tYfO","1557285368197951488","https://pbs.twimg.com/ext_tw_video_thumb/1557284750997745664/pu/img/ycaZJmuEcmy5GoVK.jpg","KejaksaanRI","in","Jakarta Selatan, DKI Jakarta","0","1","4","https://twitter.com/KejaksaanRI/status/1557285368197951488","705276546735407104","KejaksaanRI"
"1557269901211234304","Wed Aug 10 07:37:31 +0000 2022","26","Yang begini ini mana @PKSejahtera paham . Subsidi BBM Rp.502 Triliun menurut PKS masih kurang dan perlu ditambah makanya partai ini usul supaya proyek IKN dan kereta dicepat dibatalkan. https://t.co/pxBij2CLfR","1557269901211234304","https://pbs.twimg.com/media/FZyIuPAagAAT65K.jpg","","in","Indonesia","0","4","16","https://twitter.com/DoankWarto/status/1557269901211234304","938664737369341952","DoankWarto"
"1557172074955014145","Wed Aug 10 01:08:48 +0000 2022","14","Pemindahan Ibukota Negara dr Jakarta ke Nusantara sudah Final!! Pembangunan sudah dimulai. Pemindahan IKN ke Nusantaraadalah jawaban dari ketimpangan pembangunan yg selama ini terpusat di Jawa khususnya Jakarta. Dengan adanya IKN Nusantara akan tumbuh pusat ekonomi baru. https://t.co/eNa6XVkgIg","1557172074955014145","https://pbs.twimg.com/media/FZwvvS7aMAAaPZh.jpg","","in","Indonesia","1","2","12","https://twitter.com/catatankaqihati/status/1557172074955014145","1057158238779539456","catatankaqihati"
"1557513166741196800","Wed Aug 10 23:44:15 +0000 2022","6","Ibukota negara Nusantara menjadi daya tarik perusahaan investasi dari Abu Dhabi Uni Emirat Arab. Menteri BUMN @erickthohir menyampaikan: IKN menjadi hal yang sangat baik karena melihat contoh kota besar di dunia yg kini menjadi pusat pertumbuhan ekonomi. #BangkitBersamaET https://t.co/ys5GXwOug8","1557513188488663040","https://pbs.twimg.com/media/FZ1l_V_agAAckYU.jpg","Aprilia_wiji","in","","0","0","6","https://twitter.com/Aprilia_wiji/status/1557513188488663040","326453024","Aprilia_wiji"
"1557513166741196800","Wed Aug 10 23:44:13 +0000 2022","6","Pertumbuhan jumlah penduduk Indonesia yang terus meningkat dengan mayoritas anak muda membutuhkan ibukota negara baru dengan teknologi digital dan lebih maju. Menurut menteri BUMN @erickthohir IKN merupakan kota masa depan bagi generasi muda. #BangkitBersamaET https://t.co/zZyZG56WwD","1557513177159835648","https://pbs.twimg.com/media/FZ1l-rNaIAA9cqk.jpg","Aprilia_wiji","in","","0","1","6","https://twitter.com/Aprilia_wiji/status/1557513177159835648","326453024","Aprilia_wiji"
"1557235369640599552","Wed Aug 10 05:32:22 +0000 2022","6","@TalkaboutBUMN Kok tau sih min? Wih wih wih. Sekadar inpo. Bumn top tier 1-10 mulai minggu ini gila gilaan ke ikn. https://t.co/FrVacfXokz","1557238403481358337","https://pbs.twimg.com/media/FZxsCoHaUAAzJli.jpg","TalkaboutBUMN","in","ÜT: -8.6852,115.253853 ","1","1","0","https://twitter.com/ferdianshy/status/1557238403481358337","76617858","ferdianshy"
"1557409024915562496","Wed Aug 10 16:50:21 +0000 2022","4","Menteri Keuangan Sri Mulyani mengatakan prioritas utama anggaran tahun depan adalah pembangunan Ibu Kota Negara (IKN) peningkatan sumber daya manusia (SDM) dan persiapan pemilihan umum (pemilu). https://t.co/GBi1HLmX7n","1557409024915562496","https://pbs.twimg.com/media/FZ0HQBtUsAAnS02.jpg","","in","","0","0","2","https://twitter.com/CahAngo45022699/status/1557409024915562496","1354072148030091264","CahAngo45022699"
"1557161591744839680","Wed Aug 10 00:27:08 +0000 2022","9","1. Proyek IKN sah secara perundang-undangan semua demi pemerataan pembangunan. 2. Proyek kereta cepat jika saat ini dihentikan maka kerugian akan jatuh lebih besar. 3. Pertalite dan Pertamax tetap disubsidi. Mental subsidi seperti kalian membuat Indonesia sulit maju. https://t.co/oqmg3Q8WaE","1557161591744839680","https://pbs.twimg.com/media/FZwmMvVUIAIp-Yc.jpg","","in","Di Hatimu! ","2","1","4","https://twitter.com/NgkongRoses/status/1557161591744839680","2650421658","NgkongRoses"
"1557235369640599552","Wed Aug 10 05:20:18 +0000 2022","22","Terlihat banyak biyuemen ke IKN diminggu depan pada punya aktifitas haha-hihi apa nih dievent 17an IKN? ","1557235369640599552","","","in","Pengennya di Jawa terus","4","5","8","https://twitter.com/TalkaboutBUMN/status/1557235369640599552","1361669717656670210","TalkaboutBUMN"
"1557254447449120768","Wed Aug 10 06:36:07 +0000 2022","7","Langkah tepat pindah ke IKN https://t.co/15WM1fL9Ah","1557254447449120768","","","in","Banjarnegara, Indonesia","0","0","6","https://twitter.com/RstmBcl/status/1557254447449120768","1385449485472395271","RstmBcl"
"1557192116983328768","Wed Aug 10 02:28:26 +0000 2022","1","Katanya kereta cepat Nyatanya lambat. Janjinya IKN akan segera dibangun Nyatanya masih hutan belantara. Cikal bakal candi baru peninggalan rezim. #JanjimuOmdo #JanjimuOmdo Foto hanya pemanis Tanpa pemanis buatan https://t.co/YBDDFZ61ji","1557192116983328768","https://pbs.twimg.com/media/FZxB-HfVQAAZ79w.jpg","","in","Rushden, England","0","0","1","https://twitter.com/Thavit_Amoura/status/1557192116983328768","2298840092","Thavit_Amoura"
"1557187786859372544","Wed Aug 10 02:11:14 +0000 2022","9","Dukung #IbukotaNegara Baru #IKN Nusantara. Demi Kejayaan dan Kemajuan Bangsa dan Negara Indonesia. #SemangatNusantara. https://t.co/7TzLm13w6M","1557187786859372544","https://pbs.twimg.com/media/FZw-CN7UcAci7g0.jpg","","in","Candisari, Indonesia","0","6","2","https://twitter.com/DwiKilaw/status/1557187786859372544","1411110013733523457","DwiKilaw"
"1557380912299380744","Wed Aug 10 14:58:38 +0000 2022","3","Pemerintahan @jokowi sepertinya totalitas dalam pembangunan IKN tidak hanya untuk kepentingan pemindahan ibu kota namun fasilitas pendukung lainnya pun dipersiapkan. Indonesia Maju 🇮🇩 https://t.co/p7FJxpQocd","1557380912299380744","https://pbs.twimg.com/media/FZztr3rUsAA6MTT.jpg","","in","","0","0","2","https://twitter.com/T4npa4ran/status/1557380912299380744","1334739972964814849","T4npa4ran"
"1557163355160264704","Wed Aug 10 00:34:09 +0000 2022","5","Alokasi Khusus Pandemi Ditiadakan RAPBN 2023 Prioritaskan IKN dan Pemilu https://t.co/PfOAP8iWVu https://t.co/KAiHl3V4z4","1557163355160264704","https://pbs.twimg.com/media/FZwn0fBUcAApO1u.jpg","","in","Indonesia","0","2","2","https://twitter.com/KompasTV/status/1557163355160264704","71436318","KompasTV"
"1557160253049171968","Wed Aug 10 00:21:49 +0000 2022","35","Rakyat Marah jika Jokowi Teruskan Proyek IKN tapi Anggaran Pemilu Malah Kurang https://t.co/xOIzd1xM6s","1557160253049171968","","","in","Indonesia","3","4","16","https://twitter.com/geloraco/status/1557160253049171968","3319260420","geloraco"
"1557295233326428160","Wed Aug 10 09:18:11 +0000 2022","3","Bertambah 2.000 Orang Pendatang Baru Berbondong-bondong ke IKN Nusantara... https://t.co/ZYqWS7EX8i https://t.co/Y8RTXTA7Lv","1557295233326428160","https://pbs.twimg.com/media/FZyfmRgUIAA9s0T.png","","in","","0","0","0","https://twitter.com/MarahIchsan/status/1557295233326428160","797761417894051840","MarahIchsan"
"1557008999689895937","Tue Aug 09 14:20:48 +0000 2022","12","Waktu bahas OMNIBUSLAW IKN g ngomong giini? Apa ini pengalihan isu?","1557008999689895937","","","in","Parepare","0","1","2","https://twitter.com/NegaraKecil/status/1557008999689895937","2711563154","NegaraKecil"
"1557458096640991233","Wed Aug 10 20:05:21 +0000 2022","13","Rakyat akan Mengamuk jika Jokowi Meneruskan Proyek IKN tapi Anggaran Pemilu Malah Kurang! https://t.co/RwLJofiXc1","1557458096640991233","","","in","","0","2","6","https://twitter.com/keuangannews_id/status/1557458096640991233","1226436091617505281","keuangannews_id"
"1557287908331393024","Wed Aug 10 08:49:05 +0000 2022","5","nich dah benar Pak Wagub DKI kemudian adanya IKN dalam rangka pemerataan Penduduk dan Ekonomi ...","1557287908331393024","","","in","Lampung, Indonesia","0","0","3","https://twitter.com/JOINLampung/status/1557287908331393024","949525285828833280","JOINLampung"
"1557313133672558594","Wed Aug 10 10:29:19 +0000 2022","37","Kirain cm krn blom ngopi aja yg bikin kepala puyeng. Ternyata mencari KORELASI antar kata2 dibawah ini jg bikin puyeng: PdIpeh - cino - obor -rkuhp - 3babak -78T -ikn Met ngopi sore mentemen..","1557313133672558594","","","in","~#","0","8","0","https://twitter.com/papa_loren/status/1557313133672558594","1466651308102877187","papa_loren"
"1557178560544387072","Wed Aug 10 01:34:34 +0000 2022","9","Dokter kok gagal paham dan asal komen. Dasarnya apa kamu anti pemindahan IKN? Jangan sok iyes bicara BBM jija kamu gk tau masalah yang sebenarnya terkait subsidi BBM. Jangan jadi dokter pandir!! Baca ini... Jangan SESAT NALAR dan SESAT PIKIR... https://t.co/k9QXOsaBYZ","1557178560544387072","","","in","","0","2","4","https://twitter.com/_antaresh29/status/1557178560544387072","1648045466","_antaresh29"
"1557141063596675072","Tue Aug 09 23:05:34 +0000 2022","21","PKS tidak niat komentari dana korban Boeing dipake ACT 100 milyar lebih? Atau pake jurus pengalihan isu minta IKN distop?","1557141063596675072","","","in","Jakarta Capital Region","0","5","3","https://twitter.com/aewin86/status/1557141063596675072","119691957","aewin86"
"1557288677574750208","Wed Aug 10 08:52:08 +0000 2022","3","Baru 4 Triliun udah berat buat IKN https://t.co/ZvgwqUJVvJ","1557288677574750208","","","in","","1","1","0","https://twitter.com/RomitsuT/status/1557288677574750208","1038483432391634944","RomitsuT"
"1557270258746290179","Wed Aug 10 07:38:57 +0000 2022","4","2023 Prioritas Jokowi Bangun IKN #barikade98jagajokowi #Barikade98 https://t.co/s5RijjQtAC","1557270258746290179","","","in","Jakarta Capital Region","0","0","4","https://twitter.com/barikade_98/status/1557270258746290179","1420614189421195271","barikade_98"
"1557319114636398593","Wed Aug 10 10:53:05 +0000 2022","1","Di sekitar lokasi yang dipilih sebagai IKN masih banyak masalah ketidakadilan. https://t.co/NlSNeeSxY7","1557319114636398593","","","in","Jakarta, Indonesia","0","2","1","https://twitter.com/republikaonline/status/1557319114636398593","22126902","republikaonline"
"1557347753126432768","Wed Aug 10 13:28:40 +0000 2022","60","Apakah eksekutif legislatif yudikatif sudah menjalankan tugas dengan adil untuk kepentingan rakyat banyak? Apakah Omnibus Law IKN adil? Apakah pengelolaan SDA penanganan hukum dan korupsi sudah adil? Apakah PT 20% adil? Kalau belum segera perbaiki! Jangan sampai terlambat.","1557358270989291522","","AnthonyBudiawan","in","Indonesia","1","3","13","https://twitter.com/AnthonyBudiawan/status/1557358270989291522","1256945510","AnthonyBudiawan"
"1556925542280331265","Wed Aug 10 00:27:44 +0000 2022","3","@maspiyuaja Rakyat mana yg setuju? Jangan dikit2 bawa rakyat. Rakyat udah tau bbm disubsidi pemerintah kog. Dari dulu. Kalo PKS ga seneng dgn proyek IKN &amp; kereta cepat jangan bikin narasi seolah² pemerintah gak subsidi bbm! https://t.co/oeYk2SD9nA","1557161741406314496","","maspiyuaja","in","","0","0","1","https://twitter.com/how378_/status/1557161741406314496","1370742494778912776","how378_"
"1557326950678405120","Wed Aug 10 11:24:13 +0000 2022","3","Kirain Jaenul pinter ternyata tidak sama sekali.. Dia pikir subsidi itu cukup sekali diberikan dan setelah itu mati ajah.. Rakyat sedang susah dengan kenaikan semua barang si Jaenul sok makmur mendukung Kereta Cepat dan IKN. Bodohnya kira-kira bisa sembuh ga ya? ","1557326950678405120","","","in","","0","0","1","https://twitter.com/Gandawan/status/1557326950678405120","147535405","Gandawan"
"1557344635508338689","Wed Aug 10 12:41:22 +0000 2022","8","@pengarang_sajak Takutnya guru yang sudah Tercuci otak juga kebawa kesana Semoga bisa disaring dulu sebelum dikirim ke IKN","1557346364371406849","","","in","","0","0","0","https://twitter.com/ChristianHarta/status/1557346364371406849","884789908996358144","ChristianHarta"
"1556925542280331265","Tue Aug 09 14:13:16 +0000 2022","3","@maspiyuaja IKN tetap jalan subsidi masih berjalan juga tetap optimis terhadap masa depan Bangsa.https://t.co/ujcpIrXbdj","1557007104527187974","","maspiyuaja","in","indonesia","0","0","1","https://twitter.com/Wage_Esuk/status/1557007104527187974","3046442101","Wage_Esuk"
