"conversation_id_str","created_at","favorite_count","full_text","id_str","image_url","in_reply_to_screen_name","lang","location","quote_count","reply_count","retweet_count","tweet_url","user_id_str","username"
"1553427825331359744","Sat Jul 30 17:10:29 +0000 2022","913","Kehidupan nelayan nyaris mati ? Yooo ndak tahu itu bukan urusan saya ! Pokoknya yg penting IKN jalan terus. https://t.co/nu5u9NFu4X","1553427825331359744","https://pbs.twimg.com/media/FY7iXUEaUAAlYCr.jpg","","in","","15","35","337","https://twitter.com/hipohan/status/1553427825331359744","227320530","hipohan"
"1553658723364589569","Sun Jul 31 08:27:59 +0000 2022","111","Biar pada rajin bayar pajak Duitnya buat nombokin kereta cepat dan IKN. https://t.co/te8dKhO8zF","1553658723364589569","https://pbs.twimg.com/media/FY-0X7VacAEPrw5.jpg","","in","Bumi","6","27","30","https://twitter.com/pakaipeci/status/1553658723364589569","99926414","pakaipeci"
"1553722259772407808","Sun Jul 31 12:40:28 +0000 2022","22","Kawasan GBK akan digadaikan demi proyek mercu suar IKN. Sementara Kominfo ngeblok alat mencari penghidupan warga. https://t.co/ff5xvqk1Wh","1553722259772407808","https://pbs.twimg.com/media/FY_uKFHagAE2JrH.jpg","","in","","0","2","19","https://twitter.com/Abaaah/status/1553722259772407808","44295605","Abaaah"
"1553558176343408641","Sun Jul 31 01:48:27 +0000 2022","16","Pembebasan lahan IKN Nusantara tidak akan merugikan rakyat setempat Pemerintah Pusat tidak akan merugikan warganya dan pastinya akan diganti rugi yang layak. Tidak ada sebidang kecil pun tanah masyarakat yang akan pemerintah salah gunakan untuk kepentingan IKN. https://t.co/9pCeunWBS8","1553558176343408641","https://pbs.twimg.com/media/FY9Y60kaIAEz78I.jpg","","in","Indonesian","1","5","13","https://twitter.com/Clara_Shinta99/status/1553558176343408641","322559270","Clara_Shinta99"
"1553394043555823616","Sat Jul 30 14:56:15 +0000 2022","119","Menteri PUPR Basuki Hadimuljono meninjau implementasi sejumlah Kota Cerdas (Smart City) di Korea Selatan yang dapat diterapkan dalam pengembangan IKN Nusantara. #SigapMembangunNegeri https://t.co/iLid4BeTro","1553394043555823616","https://pbs.twimg.com/media/FY7DpFMacAA9P5j.jpg","","in","Jl. Pattimura no.20","1","6","18","https://twitter.com/KemenPU/status/1553394043555823616","179835283","KemenPU"
"1553728259900473344","Sun Jul 31 13:04:18 +0000 2022","1500","Satu persatu aset negara mulai diincar utk digadaikan demi kepentingan komersial utk biayai IKN. Ternyata jalan2 ke LN cari utangan blm cukup utk biayai proyek2 ambisius - Tragis! Gelora Bung Karno bakal 'digadaikan' utk biaya IKN tanpa persetujuan DPR https://t.co/ahh5EDAJzr","1553728259900473344","","","in","Jakarta, Indonesia","53","247","660","https://twitter.com/YanHarahap/status/1553728259900473344","61465123","YanHarahap"
"1553768157222866944","Sun Jul 31 15:42:50 +0000 2022","43","Pemerintah sibuk cari cara utk pembangunan IKN Sementara negara sedang tidak baik baik saja ditengah melambungnya harga2 Sembako dan meroketnya Utang negara. Ambisi besar tenaga kurang cenderung maksa banget. #DengarkanSuaraRakyat https://t.co/tPOSq9BaFS","1553768157222866944","https://pbs.twimg.com/media/FZAX5mGUUAIqR9q.jpg","","in","Jakarta Pusat, DKI Jakarta","4","3","28","https://twitter.com/RicKY_KCh/status/1553768157222866944","140727872","RicKY_KCh"
"1553663486919524353","Sun Jul 31 08:46:55 +0000 2022","465","Anggaran KPU thn 2022 Macet di Kemenkeu. Klo IKN harga mati Pemilu 2024 itu harga mati jg apa msh bs ditawar nih? https://t.co/2RV81vzYyG","1553663486919524353","","","in","~#","12","103","101","https://twitter.com/papa_loren/status/1553663486919524353","1466651308102877187","papa_loren"
"1553326772208697344","Sat Jul 30 10:28:56 +0000 2022","54","Kabaharkam Polri Tinjau Pembangunan IKN https://t.co/qsZ5izPjAz","1553326772208697344","https://pbs.twimg.com/ext_tw_video_thumb/1553326642906681344/pu/img/Z2Lssa5PzOdOAFlK.jpg","","in","","0","2","5","https://twitter.com/DivHumas_Polri/status/1553326772208697344","138290629","DivHumas_Polri"
"1553698314020761600","Sun Jul 31 11:05:19 +0000 2022","4","Indonesia bangun Terowongan Bawah Laut di IKN Nusantara Dibantu Korea Selatan https://t.co/DP7vGYQjeM","1553698314020761600","https://pbs.twimg.com/media/FY_X8oQUEAAYS1o.jpg","","in","","0","0","3","https://twitter.com/Nien1708/status/1553698314020761600","1433294367486136322","Nien1708"
"1553845212627476480","Sun Jul 31 20:49:02 +0000 2022","39","Negara sedang tak baik baik saja. Kenapa urusi IKN? Kenapa harus kereta api cepat? Mana yg untuk kesejahteraan rakyat? Kasihani lah rakyat sudah terlalu menderita. https://t.co/CzwKwl311u","1553845212627476480","https://pbs.twimg.com/media/FZBd-EQaUAA2KqQ.jpg","","in","Tegal, Jawa Tengah","0","3","11","https://twitter.com/Abahpurwa1/status/1553845212627476480","1501992429703991307","Abahpurwa1"
"1553557937528143872","Sun Jul 31 01:47:30 +0000 2022","15","Presiden Jokowi mengunjungi 3 negara di kawasan Asia Timur. Ketiga negara di Asia Timur yang dianggap mitra strategis bagi Indonesia itu yakni China Jepang dan Korsel. Dalam kunjungan tersebut Presiden Jokowi memanfaatkan untuk mempresentasikan IKN Nusantara disambut positif. https://t.co/TdgJ61RrrM","1553557937528143872","https://pbs.twimg.com/media/FY9Ys_YaMAE6rwm.jpg","","in","Indonesian","2","4","13","https://twitter.com/Clara_Shinta99/status/1553557937528143872","322559270","Clara_Shinta99"
"1553559723969900544","Sun Jul 31 01:54:36 +0000 2022","19","Konsep pembangunan ekonomi sirkular di IKN ini tertular ke banyak kota lainnya di tanah air sehingga Indonesia makin dikenal di dunia transpormasi publik sudah pasti. Sudah sering dijelaskan pihak terkait bahwa IKN Nusantara di Kalimantan Timur adalah Model Kota Masa Depan. https://t.co/vDW754fpRC","1553559723969900544","https://pbs.twimg.com/media/FY9aT1yUsAE0Jz0.jpg","","in","","1","5","14","https://twitter.com/Anggita_lung/status/1553559723969900544","2907040202","Anggita_lung"
"1553557877616300033","Sun Jul 31 01:47:16 +0000 2022","17","Yang pasti roses pembebasan lahan di IKN Nusantara itu bisa tuntas dengan baik dan tidak akan merugikan rakyat setempat. Masalah pembebasan lahan aman. Proses ini tidak akan mempengaruhi pembangunan di ibu kota baru yang terletak di Provinsi Kalimantan Timur. https://t.co/xfKvr8GKGI","1553557877616300033","https://pbs.twimg.com/media/FY9YZ8KUEAAWxO9.jpg","","in","","1","4","14","https://twitter.com/Anggita_lung/status/1553557877616300033","2907040202","Anggita_lung"
"1553379344524853249","Sat Jul 30 13:57:50 +0000 2022","3","Sudah dibilang cina itu pengkhianat Eh malah dipercaya Kan kalo sudah begini Negara jg yg sudah. Engak mau denger masukan rakyat seh. Ngotot pula dengan IKN baru. Sudahi pembangunan yg melibatkan cina. https://t.co/eRTn8PZrbY","1553379344524853249","https://pbs.twimg.com/media/FY62R6fUsAAh52I.jpg","","in","DKI Jakarta, Indonesia","0","0","1","https://twitter.com/Joniamboen/status/1553379344524853249","1536671850","Joniamboen"
"1553607965990846464","Sun Jul 31 05:06:18 +0000 2022","22","Rumah adat yang didiami oleh Suku Dayak ini memiliki arsitektur unik dengan ukiran-ukiran khas Kalimantan Timur. https://t.co/Ohz6fBZNMX","1553607965990846464","https://pbs.twimg.com/media/FY-GNhlacAga3cG.jpg","","in","","1","1","3","https://twitter.com/ikn_id/status/1553607965990846464","1455419498018656256","ikn_id"
"1553567845904105472","Sun Jul 31 02:26:53 +0000 2022","15","IKN Nusantara merupakan episentrum pembangunan nasional di Indonsia. #IbukotaNegara #IKN #SemangatNusantara #fff #followforfollowback https://t.co/Kk2WoTcFBC","1553567845904105472","https://pbs.twimg.com/media/FY9huQCUIAAkkoB.jpg","","in","Semarang, Jawa Tengah","0","8","5","https://twitter.com/infosemar3/status/1553567845904105472","1481357801163493377","infosemar3"
"1553732131951480833","Sun Jul 31 13:19:41 +0000 2022","4","Pemerintah Berencana Gadaikan Kawasan GBK Untuk Tambahan Biaya Pembangunan IKN‼️ Jangan Memaksakan Diri Jika Dana Untuk Pembangunan Proyek IKN Belum Siap️ Lebih Baik Pembangunan Proyek IKN Ditunda Saja️ Jika Dipaksakan Proyek IKN Bisa Mangkraaaaaaak️ https://t.co/lECVyMxdq7","1553732131951480833","https://pbs.twimg.com/media/FY_3IsHUIAAhIxF.jpg","","in","Medan Kota, Sumatera Utara..!!","0","2","1","https://twitter.com/edy_siregar_77/status/1553732131951480833","1291102145547087872","edy_siregar_77"
"1553564946465947648","Sun Jul 31 02:15:21 +0000 2022","17","Masyarakat gak perlu khawatir Proses perpindahan IKN berjalan dgn baik. Proses pembebasan lahan di lokasi Nusantara tidak akan rugikan masyarakat setempat. Pembebasan lahan memakai prinsip clean and clear. Tanpa meninggalkan permasalahan apalagi sampai tumpang tindig kepemilikan https://t.co/VhLcbHCbdG","1553564946465947648","https://pbs.twimg.com/media/FY9fFOsacAAGAkY.jpg","","in","Indonesia","2","3","14","https://twitter.com/catatankaqihati/status/1553564946465947648","1057158238779539456","catatankaqihati"
"1553603136182689792","Sun Jul 31 04:47:06 +0000 2022","13","Pak Menteri BUMN @erickthohir menilai rencana investasi Posco akan semakin memperkuat visi BUMN baja tersebut. Di mana nilai investasi itu akan terwujud dlm bentuk peningkatan kapasitas produksi baja otomotif u/ industri kendaraan listrik hingga proyek IKN. #BangkitBersamaET https://t.co/d65cAq1iwc","1553603136182689792","https://pbs.twimg.com/ext_tw_video_thumb/1553603023951523841/pu/img/GV2CoWwvt7Bt5uvD.jpg","","in","🌼 West Java 🌼","0","0","13","https://twitter.com/gwabdeeeee/status/1553603136182689792","2287725409","gwabdeeeee"
"1553553809988653056","Sun Jul 31 01:31:06 +0000 2022","20","Berbagai rencana strategi hingga pembangunan ibukota negara (IKN) Nusantara terus dimatangkan. Kementerian ATR/BPN juga terus mengupayakan supaya lahan untuk pembangunan IKN sudah clean and clear sehingga tidak ada tumpang tindih kepemilikan di atasnya. https://t.co/U1GNZcQsZG","1553553809988653056","https://pbs.twimg.com/media/FY9U9OiVUAEGnjm.jpg","","in","Indonesia","2","4","15","https://twitter.com/Saodah1234/status/1553553809988653056","1272953532535062529","Saodah1234"
"1553553776597823489","Sun Jul 31 01:30:58 +0000 2022","20","Ibu Kota Negara (IKN) Nusantara akan menjadi representasi bangsa yang unggul dengan mewujudkan smart city (kota pintar) kota modern berkelanjutan. Serta memiliki standar internasional sehingga menjadi contoh bagi pembangunan kota-kota lain di Indonesia. https://t.co/vt5xzcka5H","1553553776597823489","https://pbs.twimg.com/media/FY9U7QpUUAAQE7T.jpg","","in","Indonesia","1","4","15","https://twitter.com/Saodah1234/status/1553553776597823489","1272953532535062529","Saodah1234"
"1553559767007645697","Sun Jul 31 01:54:46 +0000 2022","15","Pemerintah memastikan kendaraan listrik akan digunakan di IKN Nusantara . . #BersinergiMembangunRI https://t.co/W3Qede8pqL","1553559767007645697","https://pbs.twimg.com/media/FY9aX-QUEAArBUG.jpg","","in","Indonesia","1","1","1","https://twitter.com/stithyjanker50/status/1553559767007645697","2487901944","stithyjanker50"
"1553247205892706304","Sat Jul 30 05:12:46 +0000 2022","17","NUSANTARA IKN #PoloJayanti #KaosJayanti @KaosJayanti https://t.co/COoSRkYspG","1553247205892706304","https://pbs.twimg.com/media/FY4-CqKaQAAj-S3.jpg","","in","Puncak Rajawali ","0","0","2","https://twitter.com/SekarJayanti07/status/1553247205892706304","1282321029826637830","SekarJayanti07"
"1553212365952339971","Sat Jul 30 02:54:19 +0000 2022","17","Menindak lanjuti nota penandatanganan MoU saat presiden Jokowi berkunjung ke Seoul Korea Selatan Menteri BUMN @erickthohir Thohir berharap investasi Posco Korsel - PT Krakatau Steel memperkuat industri baja dan kendaraan listrik hingga mendukung proyek IKN #BangkitBersamaET https://t.co/zNamCEtYXH","1553212365952339971","https://pbs.twimg.com/media/FY4eaa1UEAAAOYy.jpg","","in","sleman DI.YOGYAKARTA.INDONESIA","0","0","14","https://twitter.com/okijogjezz/status/1553212365952339971","3223035314","okijogjezz"
"1549989611526836225","Sun Jul 31 09:00:16 +0000 2022","21","Gila gila judi online lagi mau di normalize sama kementrian kita. Gk sekalian balik ke jaman Pak ali sadikin dimana dev game dan yg main sekalian ditarikin pajak aja semua lalu uangnya buat pembangunan IKN eh negara mksdnya #BlokirKominfo #kominfo https://t.co/sLYd6Tm7C2","1553666847152939008","https://pbs.twimg.com/media/FY-7wniacAIWS3j.jpg","NdrewsTjan","in","","2","2","7","https://twitter.com/NdrewsTjan/status/1553666847152939008","1176673445263765504","NdrewsTjan"
"1553196624297721856","Sat Jul 30 01:51:46 +0000 2022","14","Kunjungan Presiden Jokowi ke sejumlah negara lain di Asia adalah tuk jalin kerjasama di banyak bidang. Tentunya kerjasama yg saling menguntungkan. Termasuk tuk pembangunan IKN Nusantara. Pak Jokowi pun berhasil lakukan kerjasama yg fantastis nilainya https://t.co/YST2p2KHru","1553196624297721856","https://pbs.twimg.com/media/FY4QGHNacAEaZFH.jpg","","in","Indonesia","2","2","12","https://twitter.com/catatankaqihati/status/1553196624297721856","1057158238779539456","catatankaqihati"
"1553566857550266369","Sun Jul 31 02:22:57 +0000 2022","16","IKN Nusantara itu didesain sebagai kota maju di masa depan. Kota yg penuh dengan konsep yang inovatif tetap asri serta memiliki sistem jaringn transportasi unumbyg pastinya ramah lingkungan. Jadi masih meragukan IKN Nusantara? Gw sih jelas gak. https://t.co/G3St1BIjEC","1553566857550266369","https://pbs.twimg.com/media/FY9g0B9UIAA5Ugh.jpg","","in","Indonesia","2","4","13","https://twitter.com/catatankaqihati/status/1553566857550266369","1057158238779539456","catatankaqihati"
"1553557278359310337","Sun Jul 31 01:44:53 +0000 2022","17","Kunjungan kenegaraan Presiden Jokowi ke sejumlah negara dimanfaatkan untuk mempresentasikan IKN NUSANTARA. IKN Nusantara Kota Dunia Untuk Semua berkonsep Forest City &amp; Smart City masa depan dengan menjadikan Transportasi Publik sebagai layanan utama bagi Pergerakan Orang di IKN. https://t.co/ekB07tUYHv","1553557278359310337","https://pbs.twimg.com/media/FY9YGbtaIAAUb0J.jpg","","in","","2","4","13","https://twitter.com/Penyair_Berdiri/status/1553557278359310337","1240137086331748352","Penyair_Berdiri"
"1553535652595003392","Sun Jul 31 00:18:57 +0000 2022","95","Proyek KCJB dr pembangunannya sj biayanya tambal lg tambal lg bengkak sana-sini. Blm lg nanti klo sdh jd sngt berpotensi biaya operasionalnya lbh bsr dr penghasilannya alias lbh bsr pasak drpd tiang! Eh...ibu kotanya pindah ke IKN eh..bangun IKNnya ngemis sana-sini!","1553535652595003392","","","in","Bekasi - Indonesia","3","8","24","https://twitter.com/bachrum_achmadi/status/1553535652595003392","105085302","bachrum_achmadi"
"1553600098445443072","Sun Jul 31 04:35:08 +0000 2022","10","4. Sebelumnya Kementerian Investasi/BKPM juga melakukan penandatanganan MoU dengan POSCO yang menurut Bahlil juga berminat untuk berinvestasi di IKN selain Hyundai dan LG. Dengan demikian sudah ada tiga perusahaan yang menyatakan minat untuk masuk ke IKN. https://t.co/GJhqCqbgwu","1553600123950845955","https://pbs.twimg.com/media/FY9_E79akAAxvHA.jpg","KemensetnegRI","in","Jakarta Pusat, DKI Jakarta","0","1","4","https://twitter.com/KemensetnegRI/status/1553600123950845955","3522129133","KemensetnegRI"
"1553607965990846464","Sun Jul 31 05:06:25 +0000 2022","8","Rumah Lamin memiliki panjang hingga 300 meter lebar 15 meter dan tinggi 3 meter. Sehingga dikenal juga sebagai rumah panggung yang panjang yang sambung menyambung. https://t.co/nW9uROqUJ0","1553607996399550469","https://pbs.twimg.com/media/FY-GPR7aAAID8N_.jpg","ikn_id","in","","0","1","3","https://twitter.com/ikn_id/status/1553607996399550469","1455419498018656256","ikn_id"
"1553671406398779393","Sun Jul 31 09:18:28 +0000 2022","10","Menteri BUMN @erickthohir mengatakan nilai investasi itu akan terwujud dlm bentuk peningkatan kapasitas produksi baja otomotif untuk industri kendaraan listrik hingga proyek IKN. Kerja sama ini juga kian memperkokoh ekosistem baja nasional yg terintegrasi #BangkitBersamaET https://t.co/fdT0fdryPE","1553671426296532992","https://pbs.twimg.com/media/FY-_7ZmVsAAtNKA.jpg","owl_9999","in","Sampang Jawa Timur, Indonesia","0","0","7","https://twitter.com/owl_9999/status/1553671426296532992","2355332558","owl_9999"
"1553542211916013568","Sun Jul 31 00:45:01 +0000 2022","31","Pemerintah kerjasama dengan Korsel bangun infrastruktur air bersih di IKN. Booster Tekan Covid https://t.co/t5OGRgIt8n","1553542211916013568","https://pbs.twimg.com/media/FY9KaJ3UYAARnSP.jpg","","in","Indonesia","3","6","0","https://twitter.com/tatapratiwi_1/status/1553542211916013568","1536695036389101568","tatapratiwi_1"
"1553740783081390080","Sun Jul 31 13:54:04 +0000 2022","2","Indonesia bekerjasama dengan Korea Selatan untuk pembangunan Infrastruktur air bersih di IKN 🇮🇩 https://t.co/LMK92pNHPv","1553740783081390080","https://pbs.twimg.com/media/FY__AbzaQAAkiiC.jpg","","in","ÜT: 0.0,0.0","0","0","0","https://twitter.com/diiddaaa/status/1553740783081390080","589293879","diiddaaa"
"1553398418256437248","Sat Jul 30 15:13:38 +0000 2022","44","Proyek IKN punya kesamaan dgn Proyek Kereta Cepat. Yaitu tidak dieksekusi berdasarkan rational decision tapi berdasarkan emotional decision.","1553398418256437248","","","in","Indonesia","0","4","13","https://twitter.com/PartaiSocmed/status/1553398418256437248","869327120","PartaiSocmed"
"1553544205267439618","Sun Jul 31 00:52:56 +0000 2022","4","Pembangunan IKN wujudkan pemerataan ekonomi. Booster tekan Covid https://t.co/K6CuI1nvDf","1553544205267439618","https://pbs.twimg.com/media/FY9MOLIUcAE4aXb.jpg","","in","Kota Medan, Sumatera Utara","0","0","0","https://twitter.com/AuroraPutri12_/status/1553544205267439618","1510614963496587272","AuroraPutri12_"
"1553700747115896841","Sun Jul 31 11:14:59 +0000 2022","22","Kalau nanti PEMILU di UNDUR dengan alasan DANA yg tidak mencukupi tapi PEMBANGUNAN IKN di lanjutkan maka sudah jelas siapa yg pinter dan siapa yang bodoh. Dan siapa yg memegang konstitusi dan siapa yg penghianat konstitusi akan terlihat dengan jelas.","1553700747115896841","","","in","","1","1","4","https://twitter.com/73_koes/status/1553700747115896841","1107591367255965697","73_koes"
"1553215205340893184","Sat Jul 30 03:05:36 +0000 2022","2","Korsel bantu 4 hal di proyek IKN dari pemurnian air sampai pembangunan immerse tunnel . . #EkonomiNegeriMenguat https://t.co/FX3t1PTb9w","1553215205340893184","https://pbs.twimg.com/media/FY4g_2RUIAAN8hW.jpg","","in","Indonesia","0","0","1","https://twitter.com/stithyjanker50/status/1553215205340893184","2487901944","stithyjanker50"
"1553607965990846464","Sun Jul 31 05:06:35 +0000 2022","6","Umumnya Rumah Lamin memiliki tiga kamar yakni untuk orangtua untuk anak lelaki dan untuk anak perempuan. Dengan ukuran tersebut rumah ini mampu menampung hingga 30 anggota keluarga. Simak fakta lengkapnya berikut ini. https://t.co/q0WtjGF8sP","1553608039391186945","https://pbs.twimg.com/media/FY-GQ8RaMAEYQ1G.jpg","ikn_id","in","","0","1","1","https://twitter.com/ikn_id/status/1553608039391186945","1455419498018656256","ikn_id"
"1553420494170640384","Sat Jul 30 16:41:21 +0000 2022","6","Pemerintah Indonesia akan bekerja sama dengan Korea Selatan untuk membangun infrastruktur air bersih di Ibu Kota Nusantara (IKN). https://t.co/dsUbEx3NEq","1553420494170640384","https://pbs.twimg.com/media/FY7btMQaQAAZZUh.jpg","","in","","0","0","1","https://twitter.com/Sirambutmerah_/status/1553420494170640384","1074412789089746946","Sirambutmerah_"
"1553721531624132609","Sun Jul 31 12:40:57 +0000 2022","20","Lebih lanjut mas ET menyampaikan Dimana nilai investasi itu akan terwujud dalam bentuk peningkatan kapasitas produksi baja otomotif untuk industri kendaraan listrik hingga proyek Ibu Kota Nusantara (IKN) @erickthohir #BangkitBersamaET https://t.co/pudi6JmR7X","1553722381725601792","https://pbs.twimg.com/media/FY_uRUiUEAAs3mr.jpg","abby6mei","in","Central Java, Indonesia","0","1","16","https://twitter.com/abby6mei/status/1553722381725601792","1379546070783430661","abby6mei"
"1553349782571466752","Sat Jul 30 16:38:46 +0000 2022","1","@KemenPU Berkunjung ke Titik Nol IKN langsung nyari tanaman pohon menteri idola. Sehat selalu Pak Menteri andalan https://t.co/bNU6v1Aqpt","1553419843843817472","https://pbs.twimg.com/media/FY7bHJkaQAA8CPU.jpg","KemenPU","in","NKRI ","0","0","0","https://twitter.com/NsarHaq/status/1553419843843817472","130517316","NsarHaq"
"1553556037805932545","Sun Jul 31 01:39:57 +0000 2022","15","Proses perpindahan IKN berjalan dengan baik. Pembebasan Lahan IKN Nusantara diupayakan penuh &amp; dijamin tidak akan merugikan rakyat setempat. Pembebasan Lahan IKN menggunakan Prinsip CLEAN AND CLEAR yang tanpa meninggalkan permasalahan tumpang tindih kepemilikan. Support @ikn_id https://t.co/zpvVgHOdlZ","1553556037805932545","https://pbs.twimg.com/media/FY9W-fdaQAASWlp.jpg","","in","","1","5","14","https://twitter.com/Penyair_Berdiri/status/1553556037805932545","1240137086331748352","Penyair_Berdiri"
"1553650074613608449","Sun Jul 31 07:53:37 +0000 2022","14","Karena kinerja saat ini dapat dikatakan kurang baik. Banyak persoalan belum terselesaikan seperti kereta cepat atau IKN. Masyarakat juga kecewa dengan KPK dan UU Cipta Kerja yang dianggap tidak pro rakyat. Sehingga risiko kalah sangat besar. https://t.co/lAKJZTRX3z","1553650074613608449","","","in","Indonesia","0","2","7","https://twitter.com/AnthonyBudiawan/status/1553650074613608449","1256945510","AnthonyBudiawan"
"1553267855424389121","Sat Jul 30 06:34:49 +0000 2022","1","Menteri @kemkominfo Jajaki Teknologi Qualcomm untuk New Smart Metropolis IKN Nusantara Presiden @jokowi berharap new smart metropolis mampu menjadi magnet menjadi global talent magnet menjadi pusat inovasi. @PlateJohnny https://t.co/HOvJEZzqVx","1553267855424389121","https://pbs.twimg.com/ext_tw_video_thumb/1553267449868713984/pu/img/2iTBuHTuiyr6AAG_.jpg","","in","","0","0","1","https://twitter.com/ririn_said/status/1553267855424389121","1166532124121239552","ririn_said"
"1553320476008939520","Sat Jul 30 10:04:01 +0000 2022","18","Nilai investasi akan terwujud dlm bentuk peningkatan kapasitas produksi baja otomotif utk industri kendaraan listrik s/d proyek IKN. Erick Thohir menyebut kerja sama ini utk memperkokoh ekosistem baja nasional yg terintegrasi. @erickthohir #BangkitBersamaET https://t.co/qAX9PMHPzj","1553320502563074048","https://pbs.twimg.com/media/FY6AwlGacAAkX1d.jpg","CassandraRKA","in","","0","0","15","https://twitter.com/CassandraRKA/status/1553320502563074048","1243076846515662848","CassandraRKA"
"1553299160975101953","Sat Jul 30 08:39:13 +0000 2022","12","Jokowi Kumpulkan Relawan di Istana Bogor Bahas Sikap di 2024. DEMI MENGAMANKAN PROYEK IKN BARU TETAP BERJALAN SEMENTARA RAKYAT HIDUP DALAM KESENGSARAAN AKIBAT KEBUTUHAN HIDUP RAKYAT TERUS MEROKET??? https://t.co/3CTBxjlTav","1553299160975101953","","","in","","0","2","4","https://twitter.com/myputun/status/1553299160975101953","207412269","myputun"
"1553564005192847361","Sun Jul 31 02:11:37 +0000 2022","9","LG Electronics berencana merelokasi pabrik dari Cina ke Indonesia pengembangan industri baterai listrik hingga ikut terlibat membangun Ibu Kota Negara (IKN) Nusantara. https://t.co/mBPlyxHsLD","1553564005192847361","","","in","Jakarta","0","0","4","https://twitter.com/KATADATAcoid/status/1553564005192847361","552523769","KATADATAcoid"
"1553225148097970176","Sat Jul 30 03:45:07 +0000 2022","8","️ Wawancara khusus liputan 6 bersama Ketua Umum DPP PPP Ketua Umum DPP PPP @Suharso_M ingin PPP sukses meraup suara dalam pemilu 2024 Target pemerintah untuk membangun IKN dan siap digunakan 2024. Selengkapnya klik : https://t.co/e7pyFhiHu2 #SuharsoUntukPPP","1553225148097970176","","","in","Washington, DC","3","4","8","https://twitter.com/red1n1earth/status/1553225148097970176","719557340144402432","red1n1earth"
"1553370786244661249","Sat Jul 30 13:23:50 +0000 2022","2","Enak jadi rakyat; nganggur ngak ada duit ngelus perut sambil nshan lapar sambil halu lewat tol tinggal di IKN yg modern dan punya banyak kartu ","1553370786244661249","","","in","","0","0","3","https://twitter.com/st_mangkuto/status/1553370786244661249","537377028","st_mangkuto"
"1553256344807178240","Sun Jul 31 05:15:05 +0000 2022","49","@rednesia @othermeflowlsy Artinya orang pemerintahan itu emang cocok jd bahan bakar neraka. Kapan ya tu org2 bisa jd tumbal proyek pembangunan IKN?","1553610178368794625","","rednesia","in","Temanggung-Yogyakarta","2","1","3","https://twitter.com/afiiitz10/status/1553610178368794625","66356758","afiiitz10"
"1553241253885579265","Sat Jul 30 04:49:07 +0000 2022","12","Kepala Otorita IKN menyebut ibu kota baru akan punya kendaraan tanpa sopir atau driveless. https://t.co/VgQ4Ok4enU","1553241253885579265","","","in","","13","34","2","https://twitter.com/kumparan/status/1553241253885579265","759692754985242625","kumparan"
"1553211879698604032","Sat Jul 30 02:52:24 +0000 2022","9","️ Menteri PPN / kepala Bappenas @Suharso_M yg juga merupakan ketum PPP hadir dlm bincang Liputan6 beliau membagikan berbagai pandangannya dimulai dari alasan partainya membentuk KIB hingga kapan IKN baru bisa berfungsi. @Jiwamudaindo #SuharsoUntukPPP https://t.co/7mtteLrBV9","1553211879698604032","","","in","Jawa Timur, Indonesia","0","5","9","https://twitter.com/Hansunriko/status/1553211879698604032","1349266626844061696","Hansunriko"
"1553352530431655937","Sat Jul 30 12:11:17 +0000 2022","17","LG Bakal Investasi di IKN dan Relokasi Pabrik dari China ke Indonesia https://t.co/1H7oZbw4rx","1553352530431655937","","","in","","1","18","5","https://twitter.com/CNNIndonesia/status/1553352530431655937","17128975","CNNIndonesia"
"1553350273975844864","Sat Jul 30 12:02:19 +0000 2022","5",". Layanan kereta api nantinya akan terhubung dengan kawasan strategis di IKN. https://t.co/gBzgImpbdJ","1553350273975844864","","","in","Jakarta, Indonesia","0","0","2","https://twitter.com/detikfinance/status/1553350273975844864","135795460","detikfinance"
